{
  "schema_version": 1,
  "catalog": {
    "path": "skills/tastecheck-pass/assets/check-catalog.json",
    "sha256": "a4b61dbd97681471bddc36f5115aceb7ea058e9971f0468242e8cf8a0de522c6"
  },
  "artifact": {
    "type": "file",
    "path": "index.html",
    "sha256": "82c6e974cd0b2d1954d034a6cd2ee3d6f0201de38b85c3f188262aa9b2ccd1d1",
    "bytes": 54325,
    "dependency_manifest": {
      "entry": "index.html",
      "assets": [
        {
          "path": "favicon.ico",
          "bytes": 70,
          "sha256": "afd78a4f71dcecf4c0cab91367a05213e76133012388c5908ae366355df9184a"
        },
        {
          "path": "index.html",
          "bytes": 54325,
          "sha256": "82c6e974cd0b2d1954d034a6cd2ee3d6f0201de38b85c3f188262aa9b2ccd1d1"
        }
      ],
      "sha256": "b4534aa733c82de3ec4a9b2c37c3056482defb19cb4cc9b39ac0ce88a0ce33f3"
    }
  },
  "execution": {
    "mode": "audit",
    "target_origin": "repo",
    "authenticated": false,
    "writes": false,
    "injection": false,
    "authorization": null
  },
  "browser_subjects": {
    "manifest_path": "skills/tastecheck-pass/assets/browser-subject-manifest.json",
    "manifest_sha256": "0e79c5e91e2ec9b71a819371333164a28ee5ada3b24aa564982131315f4d00f9",
    "required_viewports": [
      390,
      768,
      1280
    ]
  },
  "subject_inventory": {
    "frozen_at": "2026-09-06T00:40:39Z",
    "subjects": [],
    "coverage": {
      "direction:system": [
        {
          "id": "artifact:index.html"
        }
      ],
      "foundation:color": [
        {
          "id": "artifact:index.html"
        }
      ],
      "foundation:typography": [
        {
          "id": "artifact:index.html"
        }
      ],
      "foundation:spacing": [
        {
          "id": "artifact:index.html"
        }
      ],
      "foundation:theming": [
        {
          "id": "artifact:index.html"
        }
      ],
      "structure:responsive-layout": [
        {
          "id": "route:/|state:default|viewport:390",
          "route": "/",
          "state": "default",
          "viewport": 390
        },
        {
          "id": "route:/|state:default|viewport:768",
          "route": "/",
          "state": "default",
          "viewport": 768
        },
        {
          "id": "route:/|state:default|viewport:1280",
          "route": "/",
          "state": "default",
          "viewport": 1280
        }
      ],
      "structure:component-states": [
        {
          "id": "control:component-demo|state:default",
          "control": "component-demo",
          "state": "default"
        },
        {
          "id": "control:component-demo|state:loading",
          "control": "component-demo",
          "state": "loading"
        },
        {
          "id": "control:component-demo|state:disabled",
          "control": "component-demo",
          "state": "disabled"
        }
      ],
      "structure:form-ux": [
        {
          "id": "control:email-form|state:empty",
          "control": "email-form",
          "state": "empty"
        },
        {
          "id": "control:email-form|state:invalid",
          "control": "email-form",
          "state": "invalid"
        },
        {
          "id": "control:email-form|state:valid",
          "control": "email-form",
          "state": "valid"
        }
      ],
      "structure:empty-states": [
        {
          "id": "control:empty-state-demo|state:loading",
          "control": "empty-state-demo",
          "state": "loading"
        },
        {
          "id": "control:empty-state-demo|state:empty",
          "control": "empty-state-demo",
          "state": "empty"
        },
        {
          "id": "control:empty-state-demo|state:error",
          "control": "empty-state-demo",
          "state": "error"
        },
        {
          "id": "control:empty-state-demo|state:retry",
          "control": "empty-state-demo",
          "state": "retry"
        }
      ],
      "verification:a11y": [
        {
          "id": "artifact:index.html"
        }
      ],
      "verification:deslop-ui": [
        {
          "id": "artifact:index.html"
        }
      ],
      "verification:humanize-copy": [
        {
          "id": "artifact:index.html"
        }
      ],
      "browser:rendering": [
        {
          "id": "route:/|state:default|viewport:390",
          "route": "/",
          "state": "default",
          "viewport": 390
        },
        {
          "id": "route:/|state:default|viewport:768",
          "route": "/",
          "state": "default",
          "viewport": 768
        },
        {
          "id": "route:/|state:default|viewport:1280",
          "route": "/",
          "state": "default",
          "viewport": 1280
        }
      ],
      "browser:zoom-400": [
        {
          "id": "route:/|state:default|viewport:390",
          "route": "/",
          "state": "default",
          "viewport": 390
        },
        {
          "id": "route:/|state:default|viewport:768",
          "route": "/",
          "state": "default",
          "viewport": 768
        },
        {
          "id": "route:/|state:default|viewport:1280",
          "route": "/",
          "state": "default",
          "viewport": 1280
        }
      ],
      "browser:keyboard": [
        {
          "id": "route:/|state:default|viewport:390",
          "route": "/",
          "state": "default",
          "viewport": 390
        },
        {
          "id": "route:/|state:default|viewport:768",
          "route": "/",
          "state": "default",
          "viewport": 768
        },
        {
          "id": "route:/|state:default|viewport:1280",
          "route": "/",
          "state": "default",
          "viewport": 1280
        }
      ],
      "browser:theme-contrast": [
        {
          "id": "route:/|state:default|viewport:390",
          "route": "/",
          "state": "default",
          "viewport": 390
        },
        {
          "id": "route:/|state:default|viewport:768",
          "route": "/",
          "state": "default",
          "viewport": 768
        },
        {
          "id": "route:/|state:default|viewport:1280",
          "route": "/",
          "state": "default",
          "viewport": 1280
        }
      ],
      "browser:reduced-motion": [
        {
          "id": "route:/|state:default|viewport:390",
          "route": "/",
          "state": "default",
          "viewport": 390
        },
        {
          "id": "route:/|state:default|viewport:768",
          "route": "/",
          "state": "default",
          "viewport": 768
        },
        {
          "id": "route:/|state:default|viewport:1280",
          "route": "/",
          "state": "default",
          "viewport": 1280
        }
      ],
      "browser:cold-load": [
        {
          "id": "route:/|state:default|viewport:390",
          "route": "/",
          "state": "default",
          "viewport": 390
        },
        {
          "id": "route:/|state:default|viewport:768",
          "route": "/",
          "state": "default",
          "viewport": 768
        },
        {
          "id": "route:/|state:default|viewport:1280",
          "route": "/",
          "state": "default",
          "viewport": 1280
        }
      ],
      "gate:artifact-spec": [
        {
          "id": "artifact:index.html"
        }
      ],
      "gate:required-evidence": [
        {
          "id": "artifact:index.html"
        }
      ],
      "gate:blocker-handoff": [
        {
          "id": "artifact:index.html"
        }
      ]
    },
    "sha256": "d8f553d0dbe0a6890713fa326d60c81b16c6b5b7d4edf356eb72b8492ab88e8d"
  },
  "rows": [
    {
      "skill": "tastecheck-pass",
      "check_id": "foundation:color",
      "status": "fail",
      "reason": "foundation:color — measured token contrast has passing body/accent pairs but failing UI border pairs.",
      "remediation": "Raise --line or use a higher-contrast border role in dark and light themes, then rerun rendered contrast for every interactive state.",
      "evidence": {
        "mode": "automated",
        "summary": "Measured OKLCH token pairs across dark, light, and prefers-contrast modes.",
        "details": {
          "measurements": {
            "tokens": {
              "dark": "--bg oklch(13% .018 64); --line oklch(32% .044 64); --ink oklch(94% .024 78); --muted oklch(78% .041 75); --copper oklch(76% .145 62)",
              "light": "--bg oklch(96% .023 78); --line oklch(71% .05 71); --ink oklch(19% .028 63); --muted oklch(42% .046 66); --copper oklch(55% .143 56)",
              "contrast": "--bg oklch(6% .012 63); --line oklch(72% .045 74); --ink oklch(99% .006 96); --muted oklch(88% .035 80); --copper oklch(84% .174 69)"
            },
            "pairs": [
              {
                "theme": "dark",
                "foreground": "#f4eada",
                "background": "#0c0602",
                "kind": "body",
                "ratio": 16.87
              },
              {
                "theme": "dark",
                "foreground": "#c7b49b",
                "background": "#0c0602",
                "kind": "body",
                "ratio": 10.02
              },
              {
                "theme": "dark",
                "foreground": "#f29a43",
                "background": "#1a0400",
                "kind": "ui",
                "ratio": 8.9
              },
              {
                "theme": "dark",
                "foreground": "#432e1a",
                "background": "#0c0602",
                "kind": "ui",
                "ratio": 1.57
              },
              {
                "theme": "light",
                "foreground": "#1d1106",
                "background": "#fbf0e1",
                "kind": "body",
                "ratio": 16.47
              },
              {
                "theme": "light",
                "foreground": "#5e4832",
                "background": "#fbf0e1",